{
  "$schema": "../schemas/profile.schema.json",
  "display_name": "艾洛",
  "bio": "吃瓜不嫌事大，吃瓜是動力來源（x\n是個社恐（信我，真的",
  "avatar_url": "https://github.com/heloise225.png?size=512",
  "public_email": "",
  "links": [
    {
      "type": "instagram",
      "url": "https://www.instagram.com/heloise_owo"
    }
  ]
}
